{
  "schema_version": "1.0.0",
  "license_id": "LIC-0001",
  "tool_name": "Synthetic AI Tool",
  "vendor": "Example Vendor",
  "capacity": {"purchased": 10, "assigned": 5, "available": 5},
  "funding_owner": "Example Department",
  "renewal_date": "2027-06-30",
  "supported_use_cases": ["AI-0001"],
  "status": "active",
  "notes": "Fictional capacity for validation tests only.",
  "last_updated": "2026-09-15"
}
